name,url,remote_testing,adaptive_irt,test_types,solution_type,test_types_expanded,description,duration,languages,job_levels,assessment_length,downloads,name_verification
Industrial - Semi-skilled 7.1 (International),https://www.shl.com/solutions/products/product-catalog/view/industrial-semi-skilled-7-1-%28international%29/,Yes,No,B,Pre-packaged Job Solutions,,"Our Industrial – Semi-skilled 7.1 solution is designed for entry-level positions and measures the behaviors and experiences that underlie successful and safe performance for production workers. The solution assesses behaviors and competencies foundational to industrial roles including: following policies and procedures; applying relevant trade skills; wearing required protective equipment; working with or monitoring equipment; producing high quality work; effectively working with others; and maintaining an orderly work environment. Potential job titles that use this solution include: Production and Assembly Worker, Construction Worker, Extraction Technician.
Please note this package is in International norm.",Not specified,"French (Canada), Finnish, English International, French, Danish, Norwegian, Swedish,","Entry-Level,",Approximate Completion Time in minutes = 24,"[{'title': 'Interview Report', 'url': 'https://service.shl.com/docs/Industrial%20Semi%20Skilled%207.1%20(International)%20JFA%20Interview%20Report%20UKE.pdf', 'language': 'English International'}, {'title': 'Detailed Report', 'url': 'https://service.shl.com/docs/Industrial%20Semi%20Skilled%207.1%20(International)%20JFA%20Detailed%20Report%20UKE.pdf', 'language': 'English International'}, {'title': 'Candidate Report', 'url': 'https://service.shl.com/docs/Industrial%20Semi%20Skilled%207.1%20(International)%20JFA%20Candidate%20Report%20UKE.pdf', 'language': 'English International'}, {'title': 'Product fact sheet', 'url': 'https://service.shl.com/docs/7.1Industrial_SemiSkilled_FactSheet(USE).pdf', 'language': 'English (USA)'}, {'title': 'Candidate Report', 'url': 'https://service.shl.com/docs/Candiate_Samplereport_IndustrialSemi-skilledCandidateReport_DAN.pdf', 'language': 'Danish'}, {'title': 'Detailed Report', 'url': 'https://service.shl.com/docs/Candiate_Samplereport_IndustrialSemi-skilledDetailedReport_DAN.pdf', 'language': 'Danish'}, {'title': 'Interview Report', 'url': 'https://service.shl.com/docs/Candiate_Samplereport_IndustrialSemi-skilledInterviewReport_DAN.pdf', 'language': 'Danish'}, {'title': 'Candidate Report', 'url': 'https://service.shl.com/docs/Candiate_Samplereport_IndustrialSemi-skilledCandidateReport_FRA.pdf', 'language': 'French'}, {'title': 'Detailed Report', 'url': 'https://service.shl.com/docs/Candiate_Samplereport_IndustrialSemi-skilledDetailedReport_FRA.pdf', 'language': 'French'}, {'title': 'Interview Report', 'url': 'https://service.shl.com/docs/Candiate_Samplereport_IndustrialSemi-skilledInterviewReport_FRA.pdf', 'language': 'French'}, {'title': 'Candidate Report', 'url': 'https://service.shl.com/docs/Candiate_Samplereport_IndustrialSemi-skilledCandidateReport_NOR.pdf', 'language': 'Norwegian'}, {'title': 'Detailed Report', 'url': 'https://service.shl.com/docs/Candiate_Samplereport_IndustrialSemi-skilledDetailedReport_NOR.pdf', 'language': 'Norwegian'}, {'title': 'Interview Report', 'url': 'https://service.shl.com/docs/Candiate_Samplereport_IndustrialSemi-skilledInterviewReport_NOR.pdf', 'language': 'Norwegian'}, {'title': 'Candidate Report', 'url': 'https://service.shl.com/docs/Candiate_Samplereport_IndustrialSemi-skilledCandidateReport_SVE.pdf', 'language': 'Swedish'}, {'title': 'Detailed Report', 'url': 'https://service.shl.com/docs/Candiate_Samplereport_IndustrialSemi-skilledDetailedReport_SVE.pdf', 'language': 'Swedish'}, {'title': 'Interview Report', 'url': 'https://service.shl.com/docs/Candiate_Samplereport_IndustrialSemi-skilledInterviewReport_SVE.pdf', 'language': 'Swedish'}]",Industrial - Semi-skilled 7.1 (International)
Industrial Professional and Skilled 7.1 (Americas),https://www.shl.com/solutions/products/product-catalog/view/industrial-professional-and-skilled-7-1-%28americas%29/,Yes,No,"A, B",Pre-packaged Job Solutions,,"Our Industrial – Professional and Skilled 7.1 solution is designed to measure the behaviors and experiences that underlie successful and safe performance in the workplace for specialized technical or professional industrial roles. This solution assesses mechanical comprehension and other foundational behaviors including: behaving safely and efficiently in the workplace; installing, repairing, and/or maintaining equipment and machinery; making sound mechanical decisions; maintaining an orderly work environment; and producing high quality and reliable work.
“IMPORTANT! Please note that you will need to select the correct package depending on which norm you intend to use. The package available for this product is International and Americas"".",Not specified,"Portuguese (Brazil), English (USA), French (Canada),","Entry-Level,",Approximate Completion Time in minutes = 49,"[{'title': 'Candidate Report', 'url': 'https://service.shl.com/docs/Industrial-ProfessionalandSkilled7.1_Americas_CandidateReport_CFR.pdf', 'language': 'French (Canada)'}, {'title': 'Detailed Report', 'url': 'https://service.shl.com/docs/Industrial-ProfessionalandSkilled7.1_Americas_DetailedReport_CFR.pdf', 'language': 'French (Canada)'}, {'title': 'Interview Report', 'url': 'https://service.shl.com/docs/Industrial-ProfessionalandSkilled7.1_Americas_InterviewReport_CFR.pdf', 'language': 'French (Canada)'}, {'title': 'Detailed Report', 'url': 'https://service.shl.com/docs/Industrial-ProfessionalandSkilled7.1_Americas_DetailedReport_USE.pdf', 'language': 'English (USA)'}, {'title': 'Interview Report', 'url': 'https://service.shl.com/docs/Industrial-ProfessionalandSkilled7.1_Americas_InterviewReport_USE.pdf', 'language': 'English (USA)'}, {'title': 'Candidate Report', 'url': 'https://service.shl.com/docs/Industrial-ProfessionalandSkilled7.1_Americas_CandidateReport_USE.pdf', 'language': 'English (USA)'}, {'title': 'Candidate Report', 'url': 'https://service.shl.com/docs/Industrial-ProfessionalandSkilled7.1_Americas_CandidateReport_BRA.pdf', 'language': 'Portuguese (Brazil)'}, {'title': 'Detailed Report', 'url': 'https://service.shl.com/docs/Industrial-ProfessionalandSkilled7.1_Americas_DetailedReport_BRA.pdf', 'language': 'Portuguese (Brazil)'}, {'title': 'Interview Report', 'url': 'https://service.shl.com/docs/Industrial-ProfessionalandSkilled7.1_Americas_InterviewReport_BRA.pdf', 'language': 'Portuguese (Brazil)'}]",Industrial Professional and Skilled 7.1 (Americas)
Industrial Professional and Skilled 7.1 Solution,https://www.shl.com/solutions/products/product-catalog/view/industrial-professional-and-skilled-7-1-solution/,Yes,No,"A, B",Pre-packaged Job Solutions,,"Our Industrial – Professional and Skilled 7.1 solution is designed to measure the behaviors and experiences that underlie successful and safe performance in the workplace for specialized technical or professional industrial roles. This solution assesses mechanical comprehension and other foundational behaviors including: behaving safely and efficiently in the workplace; installing, repairing, and/or maintaining equipment and machinery; making sound mechanical decisions; maintaining an orderly work environment; and producing high quality and reliable work.
“IMPORTANT! Please note that you will need to select the correct package depending on which norm you intend to use. The package available for this product is International and Americas"".",Not specified,"Portuguese (Brazil), Swedish, English International, Dutch, Italian, French, English (USA), French (Canada), Norwegian, German,","Entry-Level,",Approximate Completion Time in minutes = 49,"[{'title': 'Candidate Report', 'url': 'https://service.shl.com/docs/Industrial-ProfessionalandSkilled7.1_International_CandidateReport_INT.pdf', 'language': 'English International'}, {'title': 'Detailed Report', 'url': 'https://service.shl.com/docs/Industrial-ProfessionalandSkilled7.1_International_DetailedReport_INT.pdf', 'language': 'English International'}, {'title': 'Interview Report', 'url': 'https://service.shl.com/docs/Industrial-ProfessionalandSkilled7.1_International_InterviewReport_INT.pdf', 'language': 'English International'}, {'title': 'Candidate Report', 'url': 'https://service.shl.com/docs/Industrial-ProfessionalandSkilled7.1_International_CandidateReport_CFR.pdf', 'language': 'French (Canada)'}, {'title': 'Detailed Report', 'url': 'https://service.shl.com/docs/Industrial-ProfessionalandSkilled7.1_International_DetailedReport_CFR.pdf', 'language': 'French (Canada)'}, {'title': 'Interview Report', 'url': 'https://service.shl.com/docs/Industrial-ProfessionalandSkilled7.1_International_InterviewReport_CFR.pdf', 'language': 'French (Canada)'}, {'title': 'Candidate Report', 'url': 'https://service.shl.com/docs/Industrial-ProfessionalandSkilled7.1_International_CandidateReport_USE.pdf', 'language': 'English (USA)'}, {'title': 'Detailed Report', 'url': 'https://service.shl.com/docs/Industrial-ProfessionalandSkilled7.1_International_DetailedReport_USE.pdf', 'language': 'English (USA)'}, {'title': 'Interview Report', 'url': 'https://service.shl.com/docs/Industrial-ProfessionalandSkilled7.1_International_InterviewReport_USE.pdf', 'language': 'English (USA)'}, {'title': 'Interview Report', 'url': 'https://service.shl.com/docs/Industrial%20-%20Professional%20and%20Skilled%20Interview%20Report%20Dutch.pdf', 'language': 'Dutch'}, {'title': 'Detailed Report', 'url': 'https://service.shl.com/docs/Industrial%20-%20Professional%20and%20Skilled%20Detailed%20Report%20Dutch.pdf', 'language': 'Dutch'}, {'title': 'Candidate Report', 'url': 'https://service.shl.com/docs/Industrial%20-%20Professional%20and%20Skilled%20Candidate%20Report%20Dutch.pdf', 'language': 'Dutch'}, {'title': 'Candidate Report', 'url': 'https://service.shl.com/docs/Industrial-ProfessionalandSkilled7.1_International_CandidateReport_FRA.pdf', 'language': 'French'}, {'title': 'Detailed Report', 'url': 'https://service.shl.com/docs/Industrial-ProfessionalandSkilled7.1_International_DetailedReport_FRA.pdf', 'language': 'French'}, {'title': 'Interview Report', 'url': 'https://service.shl.com/docs/Industrial-ProfessionalandSkilled7.1_International_InterviewReport_FRA.pdf', 'language': 'French'}, {'title': 'Interview Report', 'url': 'https://service.shl.com/docs/Industrial%20-%20Professional%20and%20Skilled%20Interview%20Report%20German.pdf', 'language': 'German'}, {'title': 'Detailed Report', 'url': 'https://service.shl.com/docs/Industrial%20-%20Professional%20and%20Skilled%20Detailed%20Report%20German.pdf', 'language': 'German'}, {'title': 'Candidate Report', 'url': 'https://service.shl.com/docs/Industrial%20-%20Professional%20and%20Skilled%20Candidate%20Report%20German.pdf', 'language': 'German'}, {'title': 'Candidate Report', 'url': 'https://service.shl.com/docs/Industrial-ProfessionalandSkilled7.1_International_CandidateReport_ITA.pdf', 'language': 'Italian'}, {'title': 'Detailed Report', 'url': 'https://service.shl.com/docs/Industrial-ProfessionalandSkilled7.1_International_DetailedReport_ITA.pdf', 'language': 'Italian'}, {'title': 'Interview Report', 'url': 'https://service.shl.com/docs/Industrial-ProfessionalandSkilled7.1_International_InterviewReport_ITA.pdf', 'language': 'Italian'}, {'title': 'Candidate Report', 'url': 'https://service.shl.com/docs/Industrial-ProfessionalandSkilled7.1_International_CandidateReport_NOR.pdf', 'language': 'Norwegian'}, {'title': 'Detailed Report', 'url': 'https://service.shl.com/docs/Industrial-ProfessionalandSkilled7.1_International_DetailedReport_NOR.pdf', 'language': 'Norwegian'}, {'title': 'Interview Report', 'url': 'https://service.shl.com/docs/Industrial-ProfessionalandSkilled7.1_International_InterviewReport_NOR.pdf', 'language': 'Norwegian'}, {'title': 'Candidate Report', 'url': 'https://service.shl.com/docs/Industrial-ProfessionalandSkilled7.1_International_CandidateReport_SVE.pdf', 'language': 'Swedish'}, {'title': 'Detailed Report', 'url': 'https://service.shl.com/docs/Industrial-ProfessionalandSkilled7.1_International_DetailedReport_SVE.pdf', 'language': 'Swedish'}, {'title': 'Interview Report', 'url': 'https://service.shl.com/docs/Industrial-ProfessionalandSkilled7.1_International_InterviewReport_SVE.pdf', 'language': 'Swedish'}, {'title': 'Candidate Report', 'url': 'https://service.shl.com/docs/Industrial-ProfessionalandSkilled7.1_International_CandidateReport_BRA.pdf', 'language': 'Portuguese (Brazil)'}, {'title': 'Detailed Report', 'url': 'https://service.shl.com/docs/Industrial-ProfessionalandSkilled7.1_International_DetailedReport_BRA.pdf', 'language': 'Portuguese (Brazil)'}, {'title': 'Interview Report', 'url': 'https://service.shl.com/docs/Industrial-ProfessionalandSkilled7.1_International_InterviewReport_BRA.pdf', 'language': 'Portuguese (Brazil)'}]",Industrial Professional and Skilled 7.1 Solution
Installation and Repair Technician Solution,https://www.shl.com/solutions/products/product-catalog/view/installation-and-repair-technician-solution/,Yes,Yes,"A, B, P, S",Pre-packaged Job Solutions,,"The Installation and Repair Technician solution is designed for use with entry-level field technician positions in the telecommunications industry. The solution is focused on positions that involve installing, repairing, and maintaining telecommunications equipment, along with some customer interaction, and little to no specific sales components. Sample tasks may include: installing or repairing end-user telecommunications equipment and services, interacting with customers, and installing, or repairing telecommunications network infrastructure. Potential job titles that use this solution are: Installer, Service Technician, and Customer Installation Technician. There are multiple configurations of this solution available.",Not specified,"English (USA),","Professional Individual Contributor,",Approximate Completion Time in minutes = 49,"[{'title': 'Fact Sheet Telecommunications Suite Installation and Repair Technician One Sitting_USE', 'url': 'https://service.shl.com/docs/Fact%20Sheet%20Telecommunications%20Suite%20Installation%20and%20Repair%20Technician%20One%20Sitting_USE.pdf', 'language': 'English (USA)'}]",Installation and Repair Technician Solution
Insurance Account Manager Solution,https://www.shl.com/solutions/products/product-catalog/view/insurance-account-manager-solution/,Yes,Yes,"A, B, P, S",Pre-packaged Job Solutions,,"The Insurance Account Manager solution is for mid-level insurance professionals that manage the day-to-day operations and activities of customer accounts. Sample tasks for this job include, but are not limited to: soliciting sales of new or additional products or services; interacting with customers to provide information in response to inquiries about products and services and to handle and resolve complaints; keeping records of customer interactions and transactions; resolving customers' service or billing complaints; determining charges for services requested; collecting deposits or payments; and arranging for billing. Potential job titles that use this solution are: Account Executive, Account Manager, and Senior Account Manager. Multiple configurations of this solution are available.",Not specified,"English (USA),","Mid-Professional,",Approximate Completion Time in minutes = 48,"[{'title': 'Product fact sheet', 'url': 'https://service.shl.com/docs/Fact%20Sheet_%20Insurance%20Account%20Manager%20One%20Sitting_USE.pdf', 'language': 'English (USA)'}]",Insurance Account Manager Solution
Insurance Administrative Assistant Solution,https://www.shl.com/solutions/products/product-catalog/view/insurance-administrative-assistant-solution/,Yes,Yes,"A, B, P, S",Pre-packaged Job Solutions,,"The Administrative Assistant solution is for entry-level clerical positions that interact with external or internal customers. Sample tasks for this job include, but are not limited to: answering telephones; managing files and records; sorting mail; handling information requests; greeting customers; and collaborating with co-workers on projects. Potential job titles that use this solution are: Receptionist and Administrative Assistant. Multiple configurations of this solution are available.",Not specified,"English (USA),","Entry-Level,",Approximate Completion Time in minutes = 24,"[{'title': 'Product fact sheet', 'url': 'https://service.shl.com/docs/Fact%20Sheet_%20Insurance%20Administrative%20Assistant%20One%20Sitting_USE.pdf', 'language': 'English (USA)'}]",Insurance Administrative Assistant Solution
Insurance Agent Solution,https://www.shl.com/solutions/products/product-catalog/view/insurance-agent-solution/,Yes,Yes,"A, B, P",Pre-packaged Job Solutions,,"The Insurance Agent solution is for mid-level professional positions in the insurance industry that sell property, casualty, automotive, or other types of insurance. Sample tasks for this position include, but are not limited to: calling on policyholders to deliver and explain policies or suggest additions or changes; calculating premiums; customizing insurance programs to suit individual customers; ensuring policy requirements are fulfilled; and conferring with clients to obtain and provide information when claims are made on a policy. Potential job titles that use this solution are: Insurance Sales Professional; Insurance Sales Agent; Producer; Insurance Agent. Multiple configurations of this solution are available.",Not specified,"English (USA),","Mid-Professional,",Approximate Completion Time in minutes = 46,"[{'title': 'Product fact sheet', 'url': 'https://service.shl.com/docs/Fact%20Sheet_%20Insurance%20Agent%20One%20Sitting_USE.pdf', 'language': 'English (USA)'}]",Insurance Agent Solution
Insurance Director Solution,https://www.shl.com/solutions/products/product-catalog/view/insurance-director-solution/,Yes,Yes,"A, B, P",Pre-packaged Job Solutions,,"The Insurance Director solution is for senior-level management positions in the insurance companies that oversee sales functions across multiple brokerages, offices, or agencies or geographic territories. Sample tasks for this job includes, but is not limited to: directing a group of sales managers or agency managers; having profit and loss responsibility for a district or region; and aligning work with overall company goals. Potential job titles that use this solution are: Regional Managers, Associate Directors, and Managing Directors. Multiple configurations of this solution are available.",Not specified,"English (USA),","Director, Front Line Manager, Manager, Supervisor,",Approximate Completion Time in minutes = 49,"[{'title': 'Product fact sheet', 'url': 'https://service.shl.com/docs/Fact%20Sheet_%20Insurance%20Director%20One%20Sitting_USE.pdf', 'language': 'English (USA)'}]",Insurance Director Solution
Insurance Sales Manager Solution,https://www.shl.com/solutions/products/product-catalog/view/insurance-sales-manager-solution/,Yes,Yes,"A, B, P, S",Pre-packaged Job Solutions,,"The Sales Manager solution is for entry- to mid-level management positions that involve supervising employees working in an insurance organization and have a substantial portion of their job performance based on sales. Sample tasks for this job include, but are not limited to: planning and preparing work schedules; promoting products to customers; training subordinates; analyzing sales statistics gathered by staff to determine sales potential and monitor preferences of customers; building ongoing customer relationships; and making day-to-day decisions with minimal guidance from others. Potential job titles that use this solution are: Insurance Sales Manager, Sales Manager, Assistant Sales Manager, and Sales Supervisor. Multiple configurations of this solution are available.",Not specified,"English (USA),","Front Line Manager, Manager, Supervisor,",Approximate Completion Time in minutes = 51,"[{'title': 'Product fact sheet', 'url': 'https://service.shl.com/docs/Fact%20Sheet_%20Insurance%20Sales%20Manager%20One%20Sitting_USE.pdf', 'language': 'English (USA)'}]",Insurance Sales Manager Solution
Manager - Short Form,https://www.shl.com/solutions/products/product-catalog/view/manager-short-form/,Yes,Yes,"A, B, K, P, S",Pre-packaged Job Solutions,,"The Manager solution is an assessment used for job candidates applying to entry-level leadership positions who tend to supervise salaried employees. Sample tasks for these jobs include, but are not limited to: planning projects with subordinates; collaborating with senior managers on developing new methods and procedures; coaching employees on performance-related issues; developing employees' skills; coordinating activities with other managers to accomplish organizational goals; setting and meeting department goals; prioritizing multiple tasks and priorities; making selected strategic and day-to-day decisions; and solving employees' and customers' problems. Potential job titles that use this solution are: Manager, Store Manager, and Branch Manager.",Not specified,"English (USA),","Front Line Manager, Manager, Supervisor,",Approximate Completion Time in minutes = 57,"[{'title': 'Fact Sheet Manager One Sitting_USE', 'url': 'https://service.shl.com/docs/Fact%20Sheet%20Manager%20One%20Sitting_USE.pdf', 'language': 'English (USA)'}]",Manager - Short Form
Manager + 7.0 Solution,https://www.shl.com/solutions/products/product-catalog/view/manager-7-0-solution-3955/,Yes,Yes,"A, B, C",Pre-packaged Job Solutions,,"Our Manager + 7.0 solution is designed for candidates applying to entry-level leadership positions who tend to supervise salaried employees, and includes SHL’s new innovative mobile-first ability assessment, Verify Interactive – Deductive Reasoning. Sample tasks for these jobs include, but are not limited to: planning projects with subordinates; collaborating with senior managers on developing new methods and procedures; coaching employees on performance-related issues; developing employees ' skills; coordinating activities with other managers to accomplish organizational goals; setting and meeting department goals; prioritizing multiple tasks and priorities; making selected strategic and day-to-day decisions; and solving employees' and customers' problems.
Report Language Availability: English (USA).",Not specified,"English (USA), English International,","Front Line Manager, Manager,",Approximate Completion Time in minutes = 53,"[{'title': 'Manager + 7.0 Detailed Report', 'url': 'https://service.shl.com/docs/Manager_plus_7.0%20Detailed%20Report%20(1).pdf', 'language': 'English (USA)'}, {'title': 'Manager + 7.0 Development Report', 'url': 'https://service.shl.com/docs/Manager_plus_7.0%20Development%20Report%20(1).pdf', 'language': 'English (USA)'}, {'title': 'Manager + 7.0 Interview Report', 'url': 'https://service.shl.com/docs/Manager_plus_7.0%20Interview%20Report%20(1).pdf', 'language': 'English (USA)'}, {'title': 'Product Fact Sheet', 'url': 'https://service.shl.com/docs/ManagerPlus_7.0_FactSheet(USE).pdf', 'language': 'English (USA)'}]",Manager + 7.0 Solution
