name,url,remote_testing,adaptive_irt,test_types,solution_type,test_types_expanded,description,duration,languages,job_levels,assessment_length,downloads,name_verification
Professional 8.0 JFA,https://www.shl.com/solutions/products/product-catalog/view/professional-8-0-jfa/,Yes,No,"B, K, P",Pre-packaged Job Solutions,,The Professional 8.0 Job-Focused Assessment is designed for all non-managerial professional/individual contributor positions. It measures behaviors that underlie successful performance in a professional/individual contributor setting across a wide range of industries.,Not specified,"English International, English (USA),","Professional Individual Contributor,",Approximate Completion Time in minutes = 16,"[{'title': 'Sample Report (Interview)', 'url': 'https://service.shl.com/docs/Professional8.0_InterviewReport_UKE.pdf', 'language': 'English International'}, {'title': 'Fact Sheet', 'url': 'https://service.shl.com/docs/Professional%208.0%20JFA%20-%20Fact%20Sheet.pdf', 'language': 'English International'}, {'title': 'Sample Report (Detailed)', 'url': 'https://service.shl.com/docs/Professional8.0_DetailedReport_UKE.pdf', 'language': 'English International'}, {'title': 'Sample Report (Candidate)', 'url': 'https://service.shl.com/docs/Professional8.0_CandidateReport_UKE.pdf', 'language': 'English International'}, {'title': 'Sample Report (Interview)', 'url': 'https://service.shl.com/docs/Professional8.0_InterviewReport_USE.pdf', 'language': 'English (USA)'}, {'title': 'Sample Report (Detailed)', 'url': 'https://service.shl.com/docs/Professional8.0_DetailedReport_USE.pdf', 'language': 'English (USA)'}, {'title': 'Sample Report (Candidate)', 'url': 'https://service.shl.com/docs/Professional8.0_CandidateReport_USE.pdf', 'language': 'English (USA)'}]",Professional 8.0 JFA
Professional/Individual Contributor - Short Form,https://www.shl.com/solutions/products/product-catalog/view/professionalindividual-contributor-short-form/,Yes,Yes,"A, B, P, S",Pre-packaged Job Solutions,,"The Professional/Individual Contributor solution is for mid to upper-level, non-managerial positions. Sample tasks for these jobs include, but are not limited to: meeting with clients to determine their needs, analyzing data sets, and working with co-workers to complete projects. Potential job titles that use this solution are: Engineer, Human Resource Consultant, and IT Analyst.",Not specified,"English (USA),","Mid-Professional, Professional Individual Contributor,",Approximate Completion Time in minutes = 44,"[{'title': 'Fact Sheet Professional Individual Contributor One Sitting_USE', 'url': 'https://service.shl.com/docs/Fact%20Sheet%20Professional%20Individual%20Contributor%20One%20Sitting_USE.pdf', 'language': 'English (USA)'}]",Professional/Individual Contributor - Short Form
Project Manager - Short Form,https://www.shl.com/solutions/products/product-catalog/view/project-manager-short-form/,Yes,Yes,"A, B, P, S",Pre-packaged Job Solutions,,"The Project Manager solution is designed for positions that lead medium to large scale projects with multiple team members involved. Sample tasks for this job include, but are not limited to: guiding, supervising, and influencing project team members, scoping project resource requirements, and managing project timelines, scope and budgets. Potential job titles that ues this solution are: Project Manager, Implementation Manager, Construction Project Manager and IT Project Manager.",Not specified,"English (USA),","Professional Individual Contributor,",Approximate Completion Time in minutes = 49,"[{'title': 'Detailed Report', 'url': 'https://service.shl.com/docs/Sample_Candidate_SampleC2@shluk.com_DetailedReport_11246452.pdf', 'language': 'English (USA)'}, {'title': 'Development Report', 'url': 'https://service.shl.com/docs/Sample_Candidate_SampleC2@shluk.com_DevelopmentReport_11246452.pdf', 'language': 'English (USA)'}, {'title': 'Interview Report', 'url': 'https://service.shl.com/docs/Sample_Candidate_SampleC2@shluk.com_InterviewReport_11246452.pdf', 'language': 'English (USA)'}, {'title': 'Fact Sheet Project Manager One Sitting_USE', 'url': 'https://service.shl.com/docs/Fact%20Sheet%20Project%20Manager%20One%20Sitting_USE.pdf', 'language': 'English (USA)'}]",Project Manager - Short Form
Proof Operator - Processing Specialist -Short Form,https://www.shl.com/solutions/products/product-catalog/view/proof-operator-processing-specialist-short-form/,Yes,No,S,Pre-packaged Job Solutions,,"The Proof Operator – Processing Specialist solution is for entry-level positions that perform basic daily bank operations procedures such as the processing of deposits, reconciling accounts, and handling money transfers. Potential job titles include: Proof Operator, Bank Operations Processor, and Operations Specialist.",Not specified,"English (USA),","Entry-Level,",Approximate Completion Time in minutes = 30,"[{'title': 'Fact Sheet Proof Operator Processing Specialist One Sitting_USE', 'url': 'https://service.shl.com/docs/Fact%20Sheet%20Proof%20Operator%20Processing%20Specialist%20One%20Sitting_USE.pdf', 'language': 'English (USA)'}]",Proof Operator - Processing Specialist -Short Form
Reservation Agent Solution,https://www.shl.com/solutions/products/product-catalog/view/reservation-agent-solution/,Yes,Yes,"A, P, S, B",Pre-packaged Job Solutions,,"The Reservation Agent solution is designed for entry-level positions within the hospitality industry. Sample tasks may indlude making, updating, or canceling reservations; looking up information and entering information into a computer; providing information on the hotel and the services offered. Potential titles that use this solution are: Reservation Agent, Customer Service Representative and Reservationist. Multiple configurations of this solution are available.",Not specified,"English (USA),","Entry-Level,",Approximate Completion Time in minutes = 43,"[{'title': 'Fact Sheet Hospitality Suite Reservation Agent One Sitting_USE', 'url': 'https://service.shl.com/docs/Fact%20Sheet%20Hospitality%20Suite%20Reservation%20Agent%20One%20Sitting_USE.pdf', 'language': 'English (USA)'}]",Reservation Agent Solution
Restaurant Manager Solution,https://www.shl.com/solutions/products/product-catalog/view/restaurant-manager-solution/,Yes,Yes,"A, B, P, S",Pre-packaged Job Solutions,,"The Restaurant Manager solution is designed for management level positions in the hospitality industry. Sample tasks include purchasing food and supplies, accounting, setting policies and procedures, and managing staff. The solution is focused on managing staff, solving problems, making good decisions and maintaining focus on the customer. Potential job titles that use this solution are: Restaurant Manager and General Manager. Multiple configurations of this solution are available.",Not specified,"English (USA),","Front Line Manager, Manager, Supervisor,",Approximate Completion Time in minutes = 48,"[{'title': 'Fact Sheet Hospitality Suite Restaurant Manager One Sitting_USE', 'url': 'https://service.shl.com/docs/Fact%20Sheet%20Hospitality%20Suite%20Restaurant%20Manager%20One%20Sitting_USE.pdf', 'language': 'English (USA)'}]",Restaurant Manager Solution
Restaurant Supervisor Solution,https://www.shl.com/solutions/products/product-catalog/view/restaurant-supervisor-solution/,Yes,Yes,"A, B, P",Pre-packaged Job Solutions,,"The Restaurant Supervisor solution is designed for management level positions in the hospitality industry. Sample tasks include serving as a staff resource, setting schedules and monitoring daily operations. The solution is focused on solving problems, making good decisions and maintaining focus on the customer. Potential job titles that use this solution are: Restaurant Supervisor and Restaurant Staff Supervisor. Multiple configurations of this solution are available.",Not specified,"English (USA),","Front Line Manager, Manager, Supervisor,",Approximate Completion Time in minutes = 53,"[{'title': 'Fact Sheet Hospitality Suite Restaurant Supervisor One Sitting_USE', 'url': 'https://service.shl.com/docs/Fact%20Sheet%20Hospitality%20Suite%20Restaurant%20Supervisor%20One%20Sitting_USE.pdf', 'language': 'English (USA)'}]",Restaurant Supervisor Solution
Retail Consultant Solution,https://www.shl.com/solutions/products/product-catalog/view/retail-consultant-solution/,Yes,Yes,"A, B, P",Pre-packaged Job Solutions,,"The Retail Consultant solution is for entry to mid-level retail positions in which employees proactively sell products to customers, develop relationships with repeat customers, and have their pay and/or performance heavily based on sales revenue. Sample tasks for these jobs include, but are not limited to: promoting products to customers, persuading customers to buy products, and building ongoing customer relationships. Potential job titles that use this solution are: Sales Consultant, Sales Representative, and Retail Sales Associate. There are multiple configurations and versions of this solution available.",Not specified,"English (USA),","Entry-Level,",Approximate Completion Time in minutes = 45,"[{'title': 'Fact Sheet Retail Consultant One Sitting_USE', 'url': 'https://service.shl.com/docs/Fact%20Sheet%20Retail%20Consultant%20One%20Sitting%20_USE.pdf', 'language': 'English (USA)'}]",Retail Consultant Solution
Retail Manager w/ Sales Solution,https://www.shl.com/solutions/products/product-catalog/view/retail-manager-w-sales-solution/,Yes,Yes,"A, B, P",Pre-packaged Job Solutions,,"The Retail Manager with Sales solution is an assessment used for job candidates applying to entry-level leadership positions who tend to supervise hourly employees but also have a significant portion of their job performance based on sales and customer service. Sample tasks for these jobs include, but are not limited to: planning and preparing work schedules, assigning employees to specific duties; promoting products to customers; training subordinates; building ongoing customer relationships; and making day-to-day decisions with minimal guidance from others. Potential job titles that use this solution are: Assistant Manager, Sales Supervisor, Retail Manager, and Floor Leader. There are multiple configurations and versions of this solution available.",Not specified,"English (USA),","Front Line Manager, Manager, Supervisor,",Approximate Completion Time in minutes = 43,"[{'title': 'Fact Sheet Retail Manager with Sales One Sitting_USE', 'url': 'https://service.shl.com/docs/Fact%20Sheet%20Retail%20Manager%20with%20Sales%20One%20Sitting%20_USE.pdf', 'language': 'English (USA)'}]",Retail Manager w/ Sales Solution
Retail Sales Associate Solution,https://www.shl.com/solutions/products/product-catalog/view/retail-sales-associate-solution/,Yes,Yes,"A, B, P",Pre-packaged Job Solutions,,"The Retail Sales Associate solution is for entry-level retail positions in which employees proactively sell products to customers and have their pay and/or performance based on sales revenue. Sample tasks for these jobs include, but are not limited to: promoting products to customers, persuading customers to buy products, and completing a transaction with a customer. Potential job titles that use this solution are: Sales Representative, Retail Sales Associate, and Sales Clerk. There are multiple configurations and versions of this solution available.",Not specified,"English (USA),","Entry-Level,",Approximate Completion Time in minutes = 29,"[{'title': 'Fact Sheet Retail Sales Associate One Sitting_USE', 'url': 'https://service.shl.com/docs/Fact%20Sheet%20Retail%20Sales%20Associate%20One%20Sitting%20_USE.pdf', 'language': 'English (USA)'}]",Retail Sales Associate Solution
Sales Director Solution,https://www.shl.com/solutions/products/product-catalog/view/sales-director-solution/,Yes,Yes,"A, B, P",Pre-packaged Job Solutions,,"The Sales Director solution is for mid- to senior-level sales management positions that oversee the sales function across multiple offices or geographic territories. Sample tasks for these jobs include, but are not limited to: directing a group of sales supervisors or sales managers, having profit and loss responsibility for a district or region, and aligning work with overall company goals. Potential job titles that use this solution are: Regional Sales Director, District Sales Manager, and Sales Director. Multiple configurations of this solution are available.",Not specified,"English (USA),","Director, Front Line Manager, Manager,",Approximate Completion Time in minutes = 59,"[{'title': 'Fact Sheet Sales Director One Sitting_USE', 'url': 'https://service.shl.com/docs/Fact%20Sheet%20Sales%20Director%20One%20Sitting%20_USE.pdf', 'language': 'English (USA)'}]",Sales Director Solution
Sales Engineer Solution,https://www.shl.com/solutions/products/product-catalog/view/sales-engineer-solution/,Yes,Yes,"A, B, K, P, S",Pre-packaged Job Solutions,,"The Sales Engineer solution is designed for use with professional level telecommunications engineers with distinct sales responsibilities. The solution is focused on positions that involve the design of telecommunications networks for specific customer applications, and places an emphasis on reasoning ability and sales ability. Sample tasks may include: designing network solutions to meet customer needs, communicating technical information to all levels of clients participating in the sales process, assisting or owning the sales process, and ensuring proper implementation of contracted equipment and services. Potential job titles that use this solution are: Sales Engineer, Senior Technical Consultant, and Technical Sales Lead. There are multiple configurations of this solution available.",Not specified,"English (USA),","Professional Individual Contributor,",Approximate Completion Time in minutes = 61,"[{'title': 'Fact Sheet Telecommunications Suite Sales Engineer One Sitting_USE', 'url': 'https://service.shl.com/docs/Fact%20Sheet%20Telecommunications%20Suite%20Sales%20Engineer%20One%20Sitting_USE.pdf', 'language': 'English (USA)'}]",Sales Engineer Solution
Sales Manager Solution,https://www.shl.com/solutions/products/product-catalog/view/sales-manager-solution/,Yes,Yes,"A, B, P",Pre-packaged Job Solutions,,"The Sales Manager solution is an assessment used for applying to entry to mid-level sales leadership positions that generally manage employees and have a significant portion of their job performance based on sales. Sample tasks for these jobs include, but are not limited to: planning and preparing sales plans, promoting products to customers, training subordinates, building ongoing customer relationships, and making day-to-day decisions with minimal guidance from others. Potential job titles that use this solution are: Sales Manager and Manager of Direct Sales.",Not specified,"English (USA),","Front Line Manager, Manager,",Approximate Completion Time in minutes = 63,"[{'title': 'Product Fact Sheet', 'url': 'https://service.shl.com/docs/Fact%20Sheet%20Sales%20Manager.pdf', 'language': 'English (USA)'}]",Sales Manager Solution
Sales Professional 7.0 Solution,https://www.shl.com/solutions/products/product-catalog/view/sales-professional-7-0-solution/,Yes,No,"C, B",Pre-packaged Job Solutions,,"Our Sales Professional 7.0 solution is designed for entry to mid-level sales positions in which employees proactively sell products to customers, develop relationships with repeat customers, and have their pay and/or performance heavily based on sales revenue. Sample tasks for these jobs include, but are not limited to: promoting products to customers, persuading customers to buy products, and building ongoing customer relationships.
Report Language Availability: English (USA).",Not specified,"English International, English (USA), French (Canada), Latin American Spanish,","Mid-Professional, Professional Individual Contributor,",Approximate Completion Time in minutes = 21,"[{'title': 'Sample Report - Detailed', 'url': 'https://service.shl.com/docs/Sales%20Professional%207.0%20Detailed%20Report.pdf', 'language': 'English (USA)'}, {'title': 'Product Fact Sheet', 'url': 'https://service.shl.com/docs/SalesProfessional_7.0_FactSheet(USE).pdf', 'language': 'English (USA)'}, {'title': 'Sample Report - Development', 'url': 'https://service.shl.com/docs/Sales%20Professional%207.0%20Development%20Report.pdf', 'language': 'English (USA)'}, {'title': 'Sample Report - Interview', 'url': 'https://service.shl.com/docs/Sales%20Professional%207.0%20Interview%20Report.pdf', 'language': 'English (USA)'}]",Sales Professional 7.0 Solution
Sales Professional 7.1 (Americas),https://www.shl.com/solutions/products/product-catalog/view/sales-professional-7-1-%28americas%29/,Yes,No,"B, C",Pre-packaged Job Solutions,,"Our Sales Professional 7.1 solution is designed for entry to mid-level sales positions in which employees proactively sell products to customers, develop relationships with repeat customers, and have their pay and/or performance heavily based on sales revenue. Sample tasks for these jobs include, but are not limited to: promoting products to customers, persuading customers to buy products, and building ongoing customer relationships.",Not specified,"English (USA), Portuguese (Brazil), Latin American Spanish, French (Canada),","Professional Individual Contributor, Mid-Professional,",Approximate Completion Time in minutes = 21,[],Sales Professional 7.1 (Americas)
Sales Professional Solution,https://www.shl.com/solutions/products/product-catalog/view/sales-professional-solution/,Yes,Yes,"A, B, P",Pre-packaged Job Solutions,,"The Sales Professional solution is for entry to mid-level sales positions in which employees proactively sell products to customers, develop relationships with repeat customers, and have their pay and/or performance heavily based on sales revenue. Sample tasks for these jobs include, but are not limited to: promoting products to customers, persuading customers to buy products, and building ongoing customer relationships. Potential job titles that use this solution are: Sales Consultant, Sales Representative, and Account Representative. Multiple configurations of this solution are available.",Not specified,"English (USA),","Mid-Professional,",Approximate Completion Time in minutes = 47,"[{'title': 'Fact Sheet Sales Professional One Sitting_USE', 'url': 'https://service.shl.com/docs/Fact%20Sheet%20Sales%20Professional%20One%20Sitting%20_USE.pdf', 'language': 'English (USA)'}]",Sales Professional Solution
Sales Representative Solution,https://www.shl.com/solutions/products/product-catalog/view/sales-representative-solution/,Yes,Yes,"A, B, P",Pre-packaged Job Solutions,,"The Sales Representative solution is for entry-level sales positions in which employees proactively sell products to customers and have their pay and/or performance based on sales revenue. Sample tasks for these jobs include, but are not limited to: promoting products to customers, persuading customers to buy products, and completing a transaction with a customer. Potential job titles that use this solution are: Sales Representative, Sales Associate, and Sales Clerk. Multiple configurations of this solution are available.",Not specified,"English (USA),","Entry-Level,",Approximate Completion Time in minutes = 29,"[{'title': 'Fact Sheet Sales Representative One Sitting_USE', 'url': 'https://service.shl.com/docs/Fact%20Sheet%20Sales%20Representative%20One%20Sitting%20_USE.pdf', 'language': 'English (USA)'}]",Sales Representative Solution
Sales Supervisor Solution,https://www.shl.com/solutions/products/product-catalog/view/sales-supervisor-solution/,Yes,Yes,"A, B, P",Pre-packaged Job Solutions,,"The Sales Supervisor solution is an assessment used for job candidates applying to entry-level sales leadership positions that generally supervise employees and have a significant portion of their job performance based on sales. Sample tasks for these jobs include, but are not limited to: planning and preparing work schedules, promoting products to customers; training subordinates; building ongoing customer relationships; and making day-to-day decisions with minimal guidance from others. Potential job titles that use this solution are: Assistant Sales Manager and Sales Supervisor. Multiple configurations of this solution are available.",Not specified,"English (USA),","Front Line Manager, Manager, Supervisor,",Approximate Completion Time in minutes = 38,"[{'title': 'Fact Sheet Sales Supervisor One Sitting_USE', 'url': 'https://service.shl.com/docs/Fact%20Sheet%20Sales%20Supervisor%20One%20Sitting%20_USE.pdf', 'language': 'English (USA)'}]",Sales Supervisor Solution
Sales Support Specialist Solution,https://www.shl.com/solutions/products/product-catalog/view/sales-support-specialist-solution/,Yes,Yes,"A, B, P",Pre-packaged Job Solutions,,"The Sales Support Specialist solution is for entry to mid-level sales support positions in which employees work primarily under the guidance of an account manager or operations manager in support of client accounts. Sample tasks for these jobs include, but are not limited to: implementing customer orders, assisting with and coordinating activities, and utilizing processes to meet customer requirements. Potential job titles that use this solution are: Implementation Specialist, Project Assistant, and Sales Support Assistant. Multiple configurations of this solution are available.",Not specified,"English (USA),","Entry-Level,",Approximate Completion Time in minutes = 43,"[{'title': 'Fact Sheet Sales Support Specialist One Sitting _USE', 'url': 'https://service.shl.com/docs/Fact%20Sheet%20Sales%20Support%20Specialist%20One%20Sitting%20_USE.pdf', 'language': 'English (USA)'}]",Sales Support Specialist Solution
Senior Insurance Agent Solution,https://www.shl.com/solutions/products/product-catalog/view/senior-insurance-agent-solution/,Yes,No,"A, B, P",Pre-packaged Job Solutions,,"The Senior Insurance Agent solution is for senior-level professional positions in the insurance industry that sell a portfolio of insurance products, including property, casualty, automotive, health, and life. Sample tasks for this position include, but are not limited to: calling on policyholders to deliver and explain policies or suggest additions or changes; calculating premiums; customizing insurance programs to suit individual customers; ensuring policy requirements are fulfilled; and conferring with clients to obtain and provide information when claims are made on a policy. Potential job titles that use this solution are: Insurance Senior Sales Professional, Senior Producer, Insurance Sales Agent, and Insurance Agent. Multiple configurations of this solution are available.",Not specified,"English (USA),","Professional Individual Contributor,",Approximate Completion Time in minutes = 44,"[{'title': 'Product fact sheet', 'url': 'https://service.shl.com/docs/Fact%20Sheet_%20Senior%20Insurance%20Agent%20One%20Sitting_USE.pdf', 'language': 'English (USA)'}]",Senior Insurance Agent Solution
Senior Sales Professional Solution,https://www.shl.com/solutions/products/product-catalog/view/senior-sales-professional-solution/,Yes,Yes,"A, B, P",Pre-packaged Job Solutions,,"The Senior Sales Professional solution is for high-level sales positions in which employees proactively sell products to customers, develop relationships with new or existing customers, and have their pay and/or performance heavily based on sales revenue. Sample tasks for these jobs include, but are not limited to: promoting products to customers, consulting with and persuading customers to buy products, and building ongoing customer relationships. Potential job titles that use this solution are: Senior Sales Representative, Business Development Manager, and Senior Sales Consultant. Multiple configurations of this solution are available.",Not specified,"English (USA),","Professional Individual Contributor,",Approximate Completion Time in minutes = 42,"[{'title': 'Fact Sheet Senior Sales Professional One Sitting_USE', 'url': 'https://service.shl.com/docs/Fact%20Sheet%20Senior%20Sales%20Professional%20One%20Sitting%20_USE.pdf', 'language': 'English (USA)'}]",Senior Sales Professional Solution
Server Solution,https://www.shl.com/solutions/products/product-catalog/view/server-solution/,Yes,Yes,"B, A, P",Pre-packaged Job Solutions,,"The Server solution is designed for entry-level positions in the hospitality industry. Sample tasks include greeting customers, taking customer food and drink orders and delivering food items to guests. The solution is focused on work ethic, customer focus and sales. Potential job titles that use this solution are: Server and Waiter/Waitress. Multiple configurations of this solution are available.",Not specified,"English (USA),","Entry-Level,",Approximate Completion Time in minutes = 40,"[{'title': 'Fact Sheet Hospitality Suite Server One Sitting_USE', 'url': 'https://service.shl.com/docs/Fact%20Sheet%20Hospitality%20Suite%20Server%20One%20Sitting_USE.pdf', 'language': 'English (USA)'}]",Server Solution
