name,url,remote_testing,adaptive_irt,test_types,solution_type,test_types_expanded,description,duration,languages,job_levels,assessment_length,downloads,name_verification
Entry level Sales 7.1 (International),https://www.shl.com/solutions/products/product-catalog/view/entry-level-sales-7-1/,Yes,No,"P, B, C",Pre-packaged Job Solutions,,"The Entry Level Sales 7.1 Solution is for entry-level positions in which employees proactively sell products or services to customers and have their compensation and/or performance based on sales revenue. Sample tasks for these jobs include, but are not limited to: promoting products to customers, persuading customers to buy products, and completing a transaction with a customer.
Report Language Availability: English (USA), English International, Portuguese, French Canadian, German, French, Chinese Simplified, Spanish, North American Spanish.",Not specified,"English (USA), Spanish, Latin American Spanish, French, German, French (Canada), English International, Chinese Simplified, Portuguese,","Entry-Level,",Approximate Completion Time in minutes = 20,"[{'title': 'Candidate Report', 'url': 'https://service.shl.com/docs/EntryLevelSales7.1_CandidateReport_INT.pdf', 'language': 'English International'}, {'title': 'Detailed Report', 'url': 'https://service.shl.com/docs/EntryLevelSales7.1_DetailedReport_INT.pdf', 'language': 'English International'}, {'title': 'Interview Report', 'url': 'https://service.shl.com/docs/EntryLevelSales7.1_InterviewReport_INT.pdf', 'language': 'English International'}, {'title': 'Candidate Report', 'url': 'https://service.shl.com/docs/EntryLevelSales7.1_CandidateReport_CFR.pdf', 'language': 'French (Canada)'}, {'title': 'Detailed Report', 'url': 'https://service.shl.com/docs/EntryLevelSales7.1_DetailedReport_CFR.pdf', 'language': 'French (Canada)'}, {'title': 'Interview Report', 'url': 'https://service.shl.com/docs/EntryLevelSales7.1_InterviewReport_CFR.pdf', 'language': 'French (Canada)'}, {'title': 'Candidate Report', 'url': 'https://service.shl.com/docs/EntryLevelSales7.1_CandidateReport_ELA.pdf', 'language': 'Latin American Spanish'}, {'title': 'Detailed Report', 'url': 'https://service.shl.com/docs/EntryLevelSales7.1_DetailedReport_ELA.pdf', 'language': 'Latin American Spanish'}, {'title': 'Interview Report', 'url': 'https://service.shl.com/docs/EntryLevelSales7.1_InterviewReport_ELA.pdf', 'language': 'Latin American Spanish'}, {'title': 'Candidate Report', 'url': 'https://service.shl.com/docs/EntryLevelSales7.1_CandidateReport_USE.pdf', 'language': 'English (USA)'}, {'title': 'Detailed Report', 'url': 'https://service.shl.com/docs/EntryLevelSales7.1_DetailedReport_USE.pdf', 'language': 'English (USA)'}, {'title': 'Interview Report', 'url': 'https://service.shl.com/docs/EntryLevelSales7.1_InterviewReport_USE.pdf', 'language': 'English (USA)'}, {'title': 'Candidate Report', 'url': 'https://service.shl.com/docs/EntryLevelSales7.1_CandidateReport_CHS.pdf', 'language': 'Chinese Simplified'}, {'title': 'Detailed Report', 'url': 'https://service.shl.com/docs/EntryLevelSales7.1_DetailedReport_CHS.pdf', 'language': 'Chinese Simplified'}, {'title': 'Interview Report', 'url': 'https://service.shl.com/docs/EntryLevelSales7.1_InterviewReport_CHS.pdf', 'language': 'Chinese Simplified'}, {'title': 'Candidate Report', 'url': 'https://service.shl.com/docs/EntryLevelSales7.1_CandidateReport_FRA.pdf', 'language': 'French'}, {'title': 'Detailed Report', 'url': 'https://service.shl.com/docs/EntryLevelSales7.1_DetailedReport_FRA.pdf', 'language': 'French'}, {'title': 'Interview Report', 'url': 'https://service.shl.com/docs/EntryLevelSales7.1_InterviewReport_FRA.pdf', 'language': 'French'}, {'title': 'Candidate Report', 'url': 'https://service.shl.com/docs/EntryLevelSales7.1_CandidateReport_DEU.pdf', 'language': 'German'}, {'title': 'Detailed Report', 'url': 'https://service.shl.com/docs/EntryLevelSales7.1_DetailedReport_DEU.pdf', 'language': 'German'}, {'title': 'Interview Report', 'url': 'https://service.shl.com/docs/EntryLevelSales7.1_InterviewReport_DEU.pdf', 'language': 'German'}, {'title': 'Candidate Report', 'url': 'https://service.shl.com/docs/EntryLevelSales7.1_CandidateReport_PTG.pdf', 'language': 'Portuguese'}, {'title': 'Detailed Report', 'url': 'https://service.shl.com/docs/EntryLevelSales7.1_DetailedReport_PTG.pdf', 'language': 'Portuguese'}, {'title': 'Interview Report', 'url': 'https://service.shl.com/docs/EntryLevelSales7.1_InterviewReport_PTG.pdf', 'language': 'Portuguese'}, {'title': 'Candidate Report', 'url': 'https://service.shl.com/docs/EntryLevelSales7.1_CandidateReport_ESP.pdf', 'language': 'Spanish'}, {'title': 'Detailed Report', 'url': 'https://service.shl.com/docs/EntryLevelSales7.1_DetailedReport_ESP.pdf', 'language': 'Spanish'}, {'title': 'Interview Report', 'url': 'https://service.shl.com/docs/EntryLevelSales7.1_InterviewReport_ESP.pdf', 'language': 'Spanish'}]",Entry level Sales 7.1 (International)
Entry Level Sales Sift Out 7.1,https://www.shl.com/solutions/products/product-catalog/view/entry-level-sales-sift-out-7-1/,Yes,No,"C, P, B",Pre-packaged Job Solutions,,"The Entry Level Sales Sift Out 7.1 Solution is for entry-level positions in which employees proactively sell products or services to customers and have their compensation and/or performance based on sales revenue. Sample tasks for these jobs include, but are not limited to: promoting products to customers, persuading customers to buy products, and completing a transaction with a customer",Not specified,"Swedish, Chinese Simplified, Finnish, English (USA), Portuguese (Brazil), French, Danish, Italian, Arabic, Dutch, French (Canada), Latin American Spanish, English International, Norwegian, German,","Entry-Level,",Approximate Completion Time in minutes = 20,[],Entry Level Sales Sift Out 7.1
Event Sales Manager Solution,https://www.shl.com/solutions/products/product-catalog/view/event-sales-manager-solution/,Yes,Yes,"S, A, B, P",Pre-packaged Job Solutions,,"The Event Sales Manager solution is designed for management level positions in the hospitality industry. Sample tasks include selling use of facility space for special events and managing staff. The solution is focused on sales, solving problems and making good decisions. Potential job titles that use this solution are: Event Sales Manager, Events Manager and Special Events Manager. Multiple configurations of this solution are available.",Not specified,"English (USA),","Supervisor, Front Line Manager, Manager,",Approximate Completion Time in minutes = 50,"[{'title': 'Fact Sheet Hospitality Suite Event Sales Manager One Sitting_USE', 'url': 'https://service.shl.com/docs/Fact%20Sheet%20Hospitality%20Suite%20Event%20Sales%20Manager%20One%20Sitting_USE.pdf', 'language': 'English (USA)'}]",Event Sales Manager Solution
Executive - Short Form,https://www.shl.com/solutions/products/product-catalog/view/executive-short-form/,Yes,Yes,"A, B, P",Pre-packaged Job Solutions,,"The Executive solution is intended for use with senior executive level positions responsible for planning, directing, or coordinating key business activities and operations at the highest level of an organization. Executives at this level often accomplish their work through subordinate executives and provide overall direction to their organization by determining and formulating policies within guidelines set up by a board of directors or similar governing body. Potential job titles that use this solution are: Executive Vice President, President, and Executive Director.",Not specified,"English (USA),","Executive,",Approximate Completion Time in minutes = 74,"[{'title': 'Fact Sheet Executive One Sitting_USE', 'url': 'https://service.shl.com/docs/Fact%20Sheet%20Executive%20One%20Sitting_USE.pdf', 'language': 'English (USA)'}]",Executive - Short Form
Financial Professional - Short Form,https://www.shl.com/solutions/products/product-catalog/view/financial-professional-short-form/,Yes,No,"A, B, P",Pre-packaged Job Solutions,,"This solution is for mid-level financial institution positions that require Series 6/7 certification. Candidates answer multiple choice questions to measure financial professional aptitude, learning potential, achievement orientation, conscientiousness, persistence and planfulness, self leadership, interpersonal leadership, sales focus and customer focus.",Not specified,"English (USA),","Mid-Professional, Professional Individual Contributor,",Approximate Completion Time in minutes = 35,"[{'title': 'Fact Sheet Financial Professional One Sitting_USE', 'url': 'https://service.shl.com/docs/Fact%20Sheet%20Financial%20Professional%20One%20Sitting_USE.pdf', 'language': 'English (USA)'}]",Financial Professional - Short Form
Financial Services Representative Solution,https://www.shl.com/solutions/products/product-catalog/view/financial-services-representative-solution/,Yes,No,"A, B, P",Pre-packaged Job Solutions,,"The Financial Services Representative solution is for senior-level professional positions in the insurance industry that sell life insurance to businesses and individuals on behalf of insurance companies. Sample tasks for this position include, but are not limited to: calling on policyholders to deliver and explain policies or suggest additions or changes; calculating premiums; customizing insurance programs to suite individual customers; seeking out new clients and developing clientele by networking; ensuring policy requirements are fulfilled; and conferring with clients to obtain and provide information when calims are made on a policy. Potential job titles that use this solution are: Life Insurance Sales Professional, Insurance Sales Agent. Multiple configurations of this solution are available.",Not specified,"English (USA),","Professional Individual Contributor,",Approximate Completion Time in minutes = 44,"[{'title': 'Product fact sheet', 'url': 'https://service.shl.com/docs/Fact%20Sheet_%20Financial%20Services%20Representative%20One%20Sitting_USE.pdf', 'language': 'English (USA)'}]",Financial Services Representative Solution
Front Desk Associate Solution,https://www.shl.com/solutions/products/product-catalog/view/front-desk-associate-solution/,Yes,Yes,"A, B, P",Pre-packaged Job Solutions,,"The Front Desk Associate solution is designed for entry-level customer service positions in the hospitality industry. The solution is appropriate for positions in which the majority of work is done at the front or guest check-in desk. Sample tasks may include: welcoming guests warmly, issuing keys to guests, tabulating guest bills and accpeting payment. Potential job titles that use this solution are: Front Desk Clerk, Guest Desk Attendant, Guest Check-in Associate, or Front Office Agent. Multiple configurations of this solution are available.",Not specified,"English (USA),","Entry-Level,",Approximate Completion Time in minutes = 50,"[{'title': 'Fact Sheet Hospitality Suite Front Desk Associate One Sitting_USE', 'url': 'https://service.shl.com/docs/Fact%20Sheet%20Hospitality%20Suite%20Front%20Desk%20Associate%20One%20Sitting_USE.pdf', 'language': 'English (USA)'}]",Front Desk Associate Solution
Gaming Associate Solution,https://www.shl.com/solutions/products/product-catalog/view/gaming-associate-solution/,Yes,Yes,"A, B, P, S",Pre-packaged Job Solutions,,"The Gaming Associate solution is designed for entry to mid-level positions operating gaming tables. The solution is for highly customer service focused positions that may potentially deal with large sums of money. Sample tasks may include: dealing playing cards, counting and confirming patron bets, collecting patron losses and distributing patron winnings, and exchange currency for playing chips. Potential job titles that use this solution are: Table Games Dealer, Black Jack Dealer, Dealer, Casino Dealer, Dual Rate Dealer, Card Dealer and Gaming Dealer. Multiple configurations of this solution are available.",Not specified,"English (USA),","Entry-Level,",Approximate Completion Time in minutes = 50,"[{'title': 'Fact Sheet Hospitality Suite Gaming Associate One Sitting_USE', 'url': 'https://service.shl.com/docs/Fact%20Sheet%20Hospitality%20Suite%20Gaming%20Associate%20One%20Sitting_USE.pdf', 'language': 'English (USA)'}]",Gaming Associate Solution
Gaming Manager Solution,https://www.shl.com/solutions/products/product-catalog/view/gaming-manager-solution/,Yes,Yes,"S, A, B, K, P",Pre-packaged Job Solutions,,"The Gaming Manager solution is designed for management level positions within the hospitality industry. Sample tasks include managing operations, supervisors and associates within gaming environments. The solution is focused on security, integrity and managing sales. Potential job titles that use this solution are: Gaming Floor Manager and Gaming Manager. Multiple configurations of this solution are available.",Not specified,"English (USA),","Front Line Manager, Manager, Supervisor,",Approximate Completion Time in minutes = 55,"[{'title': 'Fact Sheet Hospitality Suite Gaming Manager One Sitting_USE', 'url': 'https://service.shl.com/docs/Fact%20Sheet%20Hospitality%20Suite%20Gaming%20Manager%20One%20Sitting_USE.pdf', 'language': 'English (USA)'}]",Gaming Manager Solution
General Entry Level - All Industries 7.0 Solution,https://www.shl.com/solutions/products/product-catalog/view/general-entry-level-all-industries-7-0-solution/,Yes,No,B,Pre-packaged Job Solutions,,"Our General Entry Level – All Industries 7.0 solution is designed for entry-level positions across industries. This solution predicts the following types of behaviors foundational to all jobs: being on-time to work; following rules and policies; treating others respectfully; producing quality work; meeting goals; and effectively working alongside others. Solution can be used across all industries with entry-level positions. Example titles include, but are not limited to: Administrator, Clerk, Veterinary Assistant, Stocker, Dish Washer, Office Coordinator, Tour Guide, Cook, Assistant, Housekeeper, Waste Collector.",Not specified,"English (USA), English International, French (Canada), Latin American Spanish,","Entry-Level,",Approximate Completion Time in minutes = 19,"[{'title': 'Detailed Report', 'url': 'https://service.shl.com/docs/General%20Entry%20Level%20All%20Industries%20Candidate%20Detailed%20Report%20NAS.pdf', 'language': 'Latin American Spanish'}, {'title': 'Development Report', 'url': 'https://service.shl.com/docs/General%20Entry%20Level%20All%20Industries%20Candidate%20Development%20Report%20NAS.pdf', 'language': 'Latin American Spanish'}, {'title': 'Interview Report', 'url': 'https://service.shl.com/docs/General%20Entry%20Level%20All%20Industries%20Candidate%20Interview%20Report%20NAS.pdf', 'language': 'Latin American Spanish'}, {'title': 'Interview Report', 'url': 'https://service.shl.com/docs/GeneralEntryLevel_AllIndustries_InterviewReport.pdf', 'language': 'English (USA)'}, {'title': 'Development Report', 'url': 'https://service.shl.com/docs/GeneralEntryLevel_AllIndustries_DevelopmentReport.pdf', 'language': 'English (USA)'}, {'title': 'Product fact sheet', 'url': 'https://service.shl.com/docs/Gen%20Entry%20Level%20%E2%80%93%20All%20Industries_Fact%20Sheet.pdf', 'language': 'English (USA)'}, {'title': 'Detailed Report', 'url': 'https://service.shl.com/docs/GeneralEntryLevel_AllIndustries_DetailedReport.pdf', 'language': 'English (USA)'}]",General Entry Level - All Industries 7.0 Solution
General Entry Level - All Industries 7.1 Solution,https://www.shl.com/solutions/products/product-catalog/view/general-entry-level-all-industries-7-1-solution/,Yes,No,B,Pre-packaged Job Solutions,,"Our General Entry Level – All Industries 7.1 solution is designed for entry-level positions across industries. This solution predicts the following types of behaviors foundational to all jobs: being on-time to work; following rules and policies; treating others respectfully; producing quality work; meeting goals; and effectively working alongside others. Solution can be used across all industries with entry-level positions. Example titles include, but are not limited to: Administrator, Clerk, Veterinary Assistant, Stocker, Dish Washer, Office Coordinator, Tour Guide, Cook, Assistant, Housekeeper, Waste Collector.
“MCP Product: please note that you will need to select the correct package depending on which norm you intend to use. The package available for this product is Americas and International.""",Not specified,"German, Norwegian, Finnish, French (Canada), Portuguese (Brazil), Latin American Spanish, English (USA), English International, Danish, Swedish, French, Italian,","Entry-Level,",Approximate Completion Time in minutes = 19,[],General Entry Level - All Industries 7.1 Solution
General Entry Level - All Industries 7.1(Americas),https://www.shl.com/solutions/products/product-catalog/view/general-entry-level-all-industries-7-1%28americas%29/,Yes,No,B,Pre-packaged Job Solutions,,"Our General Entry Level – All Industries 7.1 solution is designed for entry-level positions across industries. This solution predicts the following types of behaviors foundational to all jobs: being on-time to work; following rules and policies; treating others respectfully; producing quality work; meeting goals; and effectively working alongside others. Solution can be used across all industries with entry-level positions. Example titles include, but are not limited to: Administrator, Clerk, Veterinary Assistant, Stocker, Dish Washer, Office Coordinator, Tour Guide, Cook, Assistant, Housekeeper, Waste Collector.",Not specified,"Portuguese (Brazil), French (Canada), English (USA), Latin American Spanish,","Entry-Level,",Approximate Completion Time in minutes = 19,[],General Entry Level - All Industries 7.1(Americas)
General Entry Level – Data Entry 7.0 Solution,https://www.shl.com/solutions/products/product-catalog/view/general-entry-level-data-entry-7-0-solution/,Yes,No,"B, K",Pre-packaged Job Solutions,,"Our General Entry Level – Data Entry 7.0 solution is designed for entry-level positions that include entering data into computers or data management systems. This solution measures speed and accuracy at typing text and numbers into forms and predicts the following types of behaviors foundational to all jobs: being on-time to work; following rules and policies; treating others respectfully; producing quality work; meeting goals; and approaching work in a thorough and precise manner. This solution can be used across all industries with entry-level positions. Example titles include, but are not limited to: Accounting Clerk, Accounts Receivable Clerk, Administrative Clerk, Clerical Aide, Clerical Assistant, Office Assistant, Office Services Specialist, Staff Assistant.
Report Language Availability: English (USA)",Not specified,"English (USA),","General Population, Entry-Level,",Approximate Completion Time in minutes = 24,"[{'title': 'Detailed Report', 'url': 'https://service.shl.com/docs/Sample%20Report%20-%20Detailed%20Data%20Entry%207.0.pdf', 'language': 'English (USA)'}, {'title': 'Product fact sheet', 'url': 'https://service.shl.com/docs/Gen%20Entry%20Level%20%E2%80%93%20Data%20Entry_Fact%20Sheet.pdf', 'language': 'English (USA)'}, {'title': 'Development Report', 'url': 'https://service.shl.com/docs/Sample%20Report%20-%20Development%20Data%20Entry%207.0.pdf', 'language': 'English (USA)'}, {'title': 'Interview Report', 'url': 'https://service.shl.com/docs/Sample%20Report%20-%20Interview%20Data%20Entry%207.0.pdf', 'language': 'English (USA)'}]",General Entry Level – Data Entry 7.0 Solution
