name,url,remote_testing,adaptive_irt,test_types,solution_type,test_types_expanded,description,duration,languages,job_levels,assessment_length,downloads,name_verification
Account Manager Solution,https://www.shl.com/solutions/products/product-catalog/view/account-manager-solution/,Yes,Yes,"C, P, A, B",Pre-packaged Job Solutions,,"The Account Manager solution is an assessment used for job candidates applying to mid-level leadership positions that tend to manage the day-to-day operations and activities of client accounts. Sample tasks for these jobs include, but are not limited to: communicating with clients about project status, developing and maintaining project plans, coordinating internally with appropriate project personnel, and ensuring client expectations are being met. Potential job titles that use this solution are: Account Executive, Account Manager, and Senior Account Manager. There are multiple configurations of this solution available.",Not specified,"English (USA),","Mid-Professional,",Approximate Completion Time in minutes = 49,"[{'title': 'Product Flyer (USE)', 'url': 'https://service.shl.com/docs/Fact%20Sheet%20Account%20Manager%20One%20Sitting_USE.pdf', 'language': 'English (USA)'}]",Account Manager Solution
Administrative Professional - Short Form,https://www.shl.com/solutions/products/product-catalog/view/administrative-professional-short-form/,Yes,Yes,"A, K, P",Pre-packaged Job Solutions,,"The Administrative Professional solution is for entry to mid-level positions that involve routine clerical and administrative functions in addition to office management functions and customer service. Sample tasks for this job include, but are not limited to: arranging conference calls; drafting correspondence; scheduling meetings; greeting visitors; coordinating office activities. Potential job titles that use this solution are: Administrative Assistant, Secretary, Office Manager, Administrative Aide, and Administrative Associate.",Not specified,"English (USA),","Entry-Level,",Approximate Completion Time in minutes = 36,"[{'title': 'Product Fact Sheet', 'url': 'https://service.shl.com/docs/Fact%20Sheet%20Administrative%20Professional%20One%20Sitting_USE.pdf', 'language': 'English (USA)'}]",Administrative Professional - Short Form
Agency Manager Solution,https://www.shl.com/solutions/products/product-catalog/view/agency-manager-solution/,Yes,Yes,"A, B, P, S",Pre-packaged Job Solutions,,"The Agency Manager solution is for mid-level sales management positions that include front line management and sales responsibilities. Sample tasks for this job include, but are not limited to: directing and coordinating financial activities of workers in a branch, office, or department of an establishment, such as branch bank, brokerage firm, risk and insurance department, or credit department. Potential job titles that use this solution are: Agency Manager, Brokerage Manager. Multiple configurations of this solution are available.",Not specified,"English (USA),","Front Line Manager, Manager, Supervisor,",Approximate Completion Time in minutes = 51,"[{'title': 'Product fact sheet', 'url': 'https://service.shl.com/docs/Fact%20Sheet_%20Agency%20Manager%20Solution%20One%20Sitting_USE.pdf', 'language': 'English (USA)'}]",Agency Manager Solution
Apprentice + 8.0 Job Focused Assessment,https://www.shl.com/solutions/products/product-catalog/view/apprentice-8-0-job-focused-assessment-4261/,Yes,No,"B, P",Pre-packaged Job Solutions,,"The Apprentice + 8.0 Job-Focused Assessment is a short, targeted, globally applicable assessment which includes a short cognitive ability measure. This assessment is designed for entry-level positions appropriate for countries and industries that use an apprenticeship model. It is intended to be used multi-nationally for organisations whose business spans across regions.",Not specified,"English International, German,","General Population, Graduate, Entry-Level,",Approximate Completion Time in minutes = 30,"[{'title': 'Detailed Report', 'url': 'https://service.shl.com/docs/Apprentice%20%2B8.0%20-%20Detailed%20Sample%20Report%20(English%20-%20Aug%202023).pdf', 'language': 'English International'}, {'title': 'Candidate Report', 'url': 'https://service.shl.com/docs/Apprentice%20%2B8.0%20-%20Candidate%20Sample%20Report%20(English%20-%20Aug%202023).pdf', 'language': 'English International'}, {'title': 'Interview Report', 'url': 'https://service.shl.com/docs/Apprentice%20%2B8.0%20-%20Interview%20Sample%20Report%20(English%20-%20Aug%202023).pdf', 'language': 'English International'}, {'title': 'Fact Sheet', 'url': 'https://service.shl.com/docs/Apprentice%20%2B8.0%20JFA%20Product%20Fact%20Sheet.pdf', 'language': 'English International'}, {'title': 'Candidate Report', 'url': 'https://service.shl.com/docs/Apprentice%20%2B8.0%20-%20Candidate%20Sample%20Report%20(German%20-%20Aug%202023).pdf', 'language': 'German'}, {'title': 'Interview Report', 'url': 'https://service.shl.com/docs/Apprentice%20%2B8.0%20-%20Interview%20Sample%20Report%20(German%20-%20Aug%202023).pdf', 'language': 'German'}, {'title': 'Detailed Report', 'url': 'https://service.shl.com/docs/Apprentice%20%2B8.0%20-%20Detailed%20Sample%20Report%20(German%20-%20Aug%202023).pdf', 'language': 'German'}]",Apprentice + 8.0 Job Focused Assessment
Apprentice 8.0 Job Focused Assessment,https://www.shl.com/solutions/products/product-catalog/view/apprentice-8-0-job-focused-assessment/,Yes,No,"B, P",Pre-packaged Job Solutions,,"The Apprentice 8.0 Job-Focused Assessment is a short, targeted, globally applicable assessment. This assessment is designed for entry-level positions appropriate for countries and industries that use an apprenticeship model. It is intended to be used multi-nationally for organizations whose business spans across regions.",Not specified,"English International, German, French,","Entry-Level, General Population, Graduate,",Approximate Completion Time in minutes = 20,"[{'title': 'Fact Sheet', 'url': 'https://service.shl.com/docs/Apprentice%208.0%20JFA%20Fact%20Sheet.pdf', 'language': 'English International'}, {'title': 'Candidate Report', 'url': 'https://service.shl.com/docs/Apprentice8.0_CandidateReport_INT.pdf', 'language': 'English International'}, {'title': 'Detailed Report', 'url': 'https://service.shl.com/docs/Apprentice8.0_DetailedReport_INT.pdf', 'language': 'English International'}, {'title': 'Interview Report', 'url': 'https://service.shl.com/docs/Apprentice8.0_InterviewReport_INT.pdf', 'language': 'English International'}, {'title': 'Candidate Report', 'url': 'https://service.shl.com/docs/Apprentice8.0_CandidateReport_DEU.pdf', 'language': 'German'}, {'title': 'Detailed Report', 'url': 'https://service.shl.com/docs/Apprentice8.0_DetailedReport_DEU.pdf', 'language': 'German'}, {'title': 'Interview Report', 'url': 'https://service.shl.com/docs/Apprentice8.0_InterviewReport_DEU.pdf', 'language': 'German'}]",Apprentice 8.0 Job Focused Assessment
Bank Administrative Assistant - Short Form,https://www.shl.com/solutions/products/product-catalog/view/bank-administrative-assistant-short-form/,Yes,No,"A, B, K, P",Pre-packaged Job Solutions,,"The Administrative Assistant solution is for entry-level clerical positions that interact with external or internal customers. Sample tasks for these jobs include, but are not limited to: answering telephones, managing files and records, sorting mail, greeting customers, and collaborating with co-workers on projects. Potential job titles that use this solution are: Receptionist and Administrative Assistant. There are multiple configurations of this solution available.",Not specified,"English (USA),","Entry-Level,",Approximate Completion Time in minutes = 35,"[{'title': 'Product Fact Sheet', 'url': 'https://service.shl.com/docs/Fact%20Sheet%20Administrative%20Assistant%20One%20Sitting_USE.pdf', 'language': 'English International'}]",Bank Administrative Assistant - Short Form
Bank Collections Agent - Short Form,https://www.shl.com/solutions/products/product-catalog/view/bank-collections-agent-short-form/,Yes,No,"A, B, P",Pre-packaged Job Solutions,,"This solution is for entry-level collections positions in an inbound or outbound call center environment in a financial setting. Candidates answer multiple choice questions to measure achievement orientation, dependability, collector numerical skills, revenue recovery, customer focus, and persistence and planfulness. There are multiple configurations and versions of this solution available.",Not specified,"English (USA),","Entry-Level,",Approximate Completion Time in minutes = 45,"[{'title': 'Fact Sheet Bank Collections Agent One Sitting', 'url': 'https://service.shl.com/docs/Fact%20Sheet%20Bank%20Collections%20Agent%20One%20Sitting.pdf', 'language': 'English (USA)'}]",Bank Collections Agent - Short Form
Bank Operations Supervisor - Short Form,https://www.shl.com/solutions/products/product-catalog/view/bank-operations-supervisor-short-form/,Yes,Yes,"A, B, P, S",Pre-packaged Job Solutions,,"The Bank Operations Supervisor solution is for job candidates applying to entry-level leadership positions who tend to supervise hourly employees. Sample tasks for these jobs include, but are not limited to: planning and preparing work schedules, assigning employees to specific duties; coaching employees on attendance, conduct, schedule adherence, and work tasks, developing employees' skills ; training subordinates; prioritizing multiple tasks and priorities; and making day-to-day decisions with minimal guidance from others. Potential job titles that use this solution are: Team Leader, First Line Supervisor, Processing Supervisor, Call Center Supervisor, and Customer Service Supervisor. There are multiple configurations and versions of this solution available.",Not specified,"English (USA),","Front Line Manager, Manager, Supervisor,",Approximate Completion Time in minutes = 45,"[{'title': 'Product Fact Sheet', 'url': 'https://service.shl.com/docs/Fact%20Sheet%20Bank%20Operations%20Supervisor%20One%20Sitting_USE.pdf', 'language': 'English (USA)'}]",Bank Operations Supervisor - Short Form
Bilingual Spanish Reservation Agent Solution,https://www.shl.com/solutions/products/product-catalog/view/bilingual-spanish-reservation-agent-solution/,Yes,Yes,"B, P, S, A",Pre-packaged Job Solutions,,"The Bilingual Reservation Agent solution is designed for customer centered entry-level positions within the hospitality industry. Sample tasks may include making, updating, or canceling hotel reservations made in English or Spanish; listening to customers speak Spanish and entering information into a computer in English; providing information on the hotel and the services offered. Potential job titles that use this solution are: Bilingual Reservation Agent, Customer Service Representative and Reservationist. Multiple configurations of this solution are available.",Not specified,"English (USA), Latin American Spanish,","Entry-Level,",Approximate Completion Time in minutes = 43,"[{'title': 'Product Fact Sheet', 'url': 'https://service.shl.com/docs/Fact%20Sheet%20Hospitality%20Suite%20Bilingual%20Reservation%20Agent%20One%20Sitting_USE.pdf', 'language': 'English (USA)'}]",Bilingual Spanish Reservation Agent Solution
"Bookkeeping, Accounting, Auditing Clerk Short Form",https://www.shl.com/solutions/products/product-catalog/view/bookkeeping-accounting-auditing-clerk-short-form/,Yes,Yes,"P, S, K, B, A",Pre-packaged Job Solutions,,"The Bookkeeping, Accounting, and Auditing Clerk solution is for entry-level positions that involve entering numerical data into computer systems and maintaining financial records. Sample tasks for this job include, but are not limited to: entering financial data into computers; checking financial records for accuracy; perform routine computations on financial data. Potential job titles that use this solution are: Accounting Clerk, Bookkeeper, Accounting Associate, Auditing Clerk and Accounts Receivable Clerk.",Not specified,"English (USA),","Entry-Level,",Approximate Completion Time in minutes = 49,"[{'title': 'Product Fact Sheet', 'url': 'https://service.shl.com/docs/Fact%20Sheet%20Bookkeeping,%20Accounting,%20Auditing%20Clerk%20-%20Short%20Form.pdf', 'language': 'English International'}]","Bookkeeping, Accounting, Auditing Clerk Short Form"
Branch Manager - Short Form,https://www.shl.com/solutions/products/product-catalog/view/branch-manager-short-form/,Yes,No,"A, B, P",Pre-packaged Job Solutions,,"This solution is for mid to upper-level financial institution managerial positions. Candidates answer a series of multiple choice questions to measure management potential, management judgment, leadership potential, team management, branch manager problem solving, business leadership, leadership motivation, interpersonal leadership, self leadership, and branch manager judgment. There are multiple configurations and versions of this solution available.",Not specified,"English (USA),","Front Line Manager, Manager, Supervisor,",Approximate Completion Time in minutes = 50,"[{'title': 'Product Fact Sheet', 'url': 'https://service.shl.com/docs/Fact%20Sheet%20Branch%20Manager%20One%20Sitting_USE.pdf', 'language': 'English (USA)'}]",Branch Manager - Short Form
Cashier Solution,https://www.shl.com/solutions/products/product-catalog/view/cashier-solution/,Yes,Yes,"B, A, P",Pre-packaged Job Solutions,,"The Cashier solution is for entry-level retail positions in which employees receive payment in the form of cash, check, or credit cards for goods purchased. Sample tasks for these jobs include, but are not limited to: handling payments, offering customer service, and issuing receipts and refunds. Potential job titles that use this solution are: Cashier, Sales Associate, and Clerk. There are multiple configurations and versions of this solution available.",Not specified,"English (USA),","Entry-Level,",Approximate Completion Time in minutes = 28,"[{'title': 'Fact Sheet Cashier One Sitting_USE', 'url': 'https://service.shl.com/docs/Fact%20Sheet%20Cashier%20One%20Sitting_USE.pdf', 'language': 'English (USA)'}]",Cashier Solution
Claims/Operations Supervisor Solution,https://www.shl.com/solutions/products/product-catalog/view/claimsoperations-supervisor-solution/,Yes,Yes,"P, S, A, B",Pre-packaged Job Solutions,,"The Claims/Operations Supervisor solution is for entry-level management positions that involve supervising hourly employees. Sample tasks for this job include, but are not limited to: planning and preapring work schedules; assigning employees to specific dutites; coaching employees on attendance, conduct, schedule adherence, and work tasks; developing employees' skills; training subordinates; prioritizing multiple tasks and priorities; making day-to-day decisions with minimal guidance from others. Potential job titles that use this solution are: Team Leader, Coach, First Line Supervisor, Claims Supervisor, Operations Supervisor, and Customer Service Supervisor. Multiple configurations of this solution are available.",Not specified,"English (USA),","Manager,",Approximate Completion Time in minutes = 48,"[{'title': 'Product fact sheet', 'url': 'https://service.shl.com/docs/Fact%20Sheet_%20Claims%20Operations%20Supervisor%20One%20Sitting_USE.pdf', 'language': 'English (USA)'}]",Claims/Operations Supervisor Solution
Contact Center Customer Service + 8.0,https://www.shl.com/solutions/products/product-catalog/view/contact-center-customer-service-8-0/,Yes,No,"A, B, C, P, S",Pre-packaged Job Solutions,,"The Contact Center + 8.0 - Customer Service Job Focused Assessment is designed to measure the skills, competencies, and behaviors needed for success in contact center roles where the main focus is customer service. This JFA includes a mobile-optimized contact center simulation, a behavioral assessment, and a cognitive test. Together, these assessments capture the ability to provide exceptional customer service in entry-level contact center roles.",Not specified,"English (USA), English International, French, German, Latin American Spanish, Chinese Simplified, Portuguese (Brazil), Japanese,","Entry-Level,",Approximate Completion Time in minutes = 41,"[{'title': 'Product fact sheet', 'url': 'https://service.shl.com/docs/Contact%20Center%20Customer%20Service%20%2B%208.0%20JFA%20Product%20Fact%20Sheet.pdf', 'language': 'English (USA)'}, {'title': 'Candidate Report', 'url': 'https://service.shl.com/docs/Contact%20Centre%2B8.0_SampleCandidate%20Report.pdf', 'language': 'English (USA)'}, {'title': 'Detailed Report', 'url': 'https://service.shl.com/docs/Contact%20Centre%2B8.0_SampleDetailed%20Report.pdf', 'language': 'English (USA)'}, {'title': 'Interview Report', 'url': 'https://service.shl.com/docs/Contact%20Centre%2B8.0_SampleInterview%20Report.pdf', 'language': 'English (USA)'}, {'title': 'Candidate Report', 'url': 'https://service.shl.com/docs/Contact%20Center%20Customer%20Service%20%2B%208.0%20Candidate%20Report%20Japanese.pdf', 'language': 'Japanese'}, {'title': 'Detailed Report', 'url': 'https://service.shl.com/docs/Contact%20Center%20Customer%20Service%20%2B%208.0%20Detailed%20Report%20Japanese.pdf', 'language': 'Japanese'}, {'title': 'Interview Report', 'url': 'https://service.shl.com/docs/Contact%20Center%20Customer%20Service%20%2B%208.0%20Interview%20Report%20Japanese.pdf', 'language': 'Japanese'}]",Contact Center Customer Service + 8.0
Contact Center Customer Service 8.0,https://www.shl.com/solutions/products/product-catalog/view/contact-center-customer-service-8-0-4269/,Yes,No,"S, B, C, P",Pre-packaged Job Solutions,,The Customer Service 8.0 JFA is designed for entry-level positions in a contact center environment where the main focus is customer service.,Not specified,"English (USA), German, Portuguese (Brazil), English International, Latin American Spanish, French (Canada), French,","Entry-Level,",Approximate Completion Time in minutes = 31,"[{'title': 'Interview Report', 'url': 'https://service.shl.com/docs/Contact%20Center%20Customer%20Service%208.0%20Interview%20Report%20Canadian%20French.pdf', 'language': 'French (Canada)'}, {'title': 'Detailed Report', 'url': 'https://service.shl.com/docs/Contact%20Center%20Customer%20Service%208.0%20Detailed%20Report%20Canadian%20French.pdf', 'language': 'French (Canada)'}, {'title': 'Candidate Report', 'url': 'https://service.shl.com/docs/Contact%20Center%20Customer%20Service%208.0%20Candidate%20Report%20Canadian%20French.pdf', 'language': 'French (Canada)'}, {'title': 'Product fact sheet', 'url': 'https://service.shl.com/docs/Contact%20Center%20Customer%20Service%208.0%20JFA%20Product%20Fact%20Sheet.pdf', 'language': 'English (USA)'}, {'title': 'Candidate Report', 'url': 'https://service.shl.com/docs/CustomerService8.0_CandidateReport_USE.pdf', 'language': 'English (USA)'}, {'title': 'Detailed Report', 'url': 'https://service.shl.com/docs/CustomerService8.0_DetailedReport_USE.pdf', 'language': 'English (USA)'}, {'title': 'Interview Report', 'url': 'https://service.shl.com/docs/CustomerService8.0_InterviewReport_USE.pdf', 'language': 'English (USA)'}, {'title': 'Candidate Report', 'url': 'https://service.shl.com/docs/Contact%20Center%20Customer%20Service%208.0%20Candidate%20Report%20Japanese.pdf', 'language': 'Japanese'}, {'title': 'Detailed Report', 'url': 'https://service.shl.com/docs/Contact%20Center%20Customer%20Service%208.0%20Detailed%20Report%20Japanese.pdf', 'language': 'Japanese'}, {'title': 'Interview Report', 'url': 'https://service.shl.com/docs/Contact%20Center%20Customer%20Service%208.0%20Interview%20Report%20Japanese.pdf', 'language': 'Japanese'}]",Contact Center Customer Service 8.0
Contact Center Manager - Short Form,https://www.shl.com/solutions/products/product-catalog/view/contact-center-manager-short-form/,Yes,Yes,"A, B, P, S",Pre-packaged Job Solutions,,"The Contact Center - Manager solution is for mid to upper-level contact center managerial positions. Sample tasks for these jobs include, but are not limited to: supervising and coordinating the activities of subordinates; interacting day-to-day with subordinates; and training employees. Potential job titles that use this solution are: Contact Center Team Leader, First Line Supervisor, and Contact Center Manager.",Not specified,"English (USA),","Manager, Supervisor, Front Line Manager,",Approximate Completion Time in minutes = 50,"[{'title': 'Fact Sheet CC Manager One Sitting_USE', 'url': 'https://service.shl.com/docs/Fact%20Sheet%20CC%20Manager%20One%20Sitting_USE.pdf', 'language': 'English (USA)'}]",Contact Center Manager - Short Form
Contact Center Sales & Service + 8.0,https://www.shl.com/solutions/products/product-catalog/view/contact-center-sales-and-service-8-0/,Yes,No,"P, B, C, A, S",Pre-packaged Job Solutions,,"The Contact Center + 8.0 - Sales & Service Job Focused Assessment is designed to measure the skills, competencies, and behaviors needed for success in contact center roles that involve sales-related behaviors such as recommending products or services and retaining customers. This JFA includes a mobile-optimized contact center simulation, a behavioral assessment, and a cognitive test. Together, these assessments capture the ability to provide exceptional customer service and drive sales in entry-level contact center roles.",Not specified,"English International, English (USA),","Entry-Level,",Approximate Completion Time in minutes = 41,"[{'title': 'Product fact sheet', 'url': 'https://service.shl.com/docs/Contact%20Center%20Sales%20&%20Service%20%2B%208.0%20JFA%20Product%20Fact%20Sheet.pdf', 'language': 'English (USA)'}, {'title': 'Candidate Report', 'url': 'https://service.shl.com/docs/Sales&Service%2B8.0_CandidateReport_USE.pdf', 'language': 'English (USA)'}, {'title': 'Detailed Report', 'url': 'https://service.shl.com/docs/Sales&Service%2B8.0_DetailedReport_USE.pdf', 'language': 'English (USA)'}, {'title': 'Interview Report', 'url': 'https://service.shl.com/docs/Sales&Service%2B8.0_InterviewReport_USE.pdf', 'language': 'English (USA)'}]",Contact Center Sales & Service + 8.0
Contact Center Sales & Service 8.0,https://www.shl.com/solutions/products/product-catalog/view/contact-center-sales-and-service-8-0-4268/,Yes,No,"S, B, C, P",Pre-packaged Job Solutions,,The Sales & Service 8.0 JFA is designed for contact center roles that involve sales or sales-related behaviors such as recommending products or services and retaining customers.,Not specified,"English International, English (USA),","Entry-Level,",Approximate Completion Time in minutes = 31,"[{'title': 'Product fact sheet', 'url': 'https://service.shl.com/docs/Contact%20Center%20Sales%20&%20Service%208.0%20JFA%20Product%20Fact%20Sheet.pdf', 'language': 'English (USA)'}, {'title': 'Candidate Report', 'url': 'https://service.shl.com/docs/Sales&Service8.0_CandidateReport_USE.pdf', 'language': 'English (USA)'}, {'title': 'Detailed Report', 'url': 'https://service.shl.com/docs/Sales&Service8.0_DetailedReport_USE.pdf', 'language': 'English (USA)'}, {'title': 'Interview Report', 'url': 'https://service.shl.com/docs/Sales&Service8.0_InterviewReport_USE.pdf', 'language': 'English (USA)'}]",Contact Center Sales & Service 8.0
Contact Center Team Lead/Coach - Short Form,https://www.shl.com/solutions/products/product-catalog/view/contact-center-team-leadcoach-short-form/,Yes,Yes,"A, B, P, S",Pre-packaged Job Solutions,,"The Contact Center - Team Lead/Coach solution is for job candidates applying to entry-level leadership positions who tend to supervise hourly employees. Sample tasks for these jobs include, but are not limited to: planning and preparing work schedules; assigning employees to specific duties; coaching employees on attendance, conduct, schedule adherence, and work tasks; developing employees' skills; training subordinates or less tenured peers; prioritizing multiple tasks and priorities; and making day-to-day decisions with minimal guidance from others. Potential job titles that use this solution are: Team Leader, Coach, First Line Supervisor, Processing Supervisor, Call Center Supervisor, and Customer Service Supervisor.",Not specified,"English (USA),","Front Line Manager, Professional Individual Contributor, Supervisor,",Approximate Completion Time in minutes = 45,"[{'title': 'Fact Sheet CC Team Lead Coach One Sitting_USE', 'url': 'https://service.shl.com/docs/Fact%20Sheet%20CC%20Team%20Lead%20Coach%20One%20Sitting_USE.pdf', 'language': 'English (USA)'}]",Contact Center Team Lead/Coach - Short Form
Contact Centre Agent Solution - UK,https://www.shl.com/solutions/products/product-catalog/view/contact-centre-agent-solution-uk/,Yes,No,"A, B, P, S",Pre-packaged Job Solutions,,"This solution is used for job candidates applying to entry-level positions in a contact centre environment where the main focus of the job is customer service. The candidate answers multiple choice questions as well as questions in a customer call simulation environment. The solution measures: working with information, customer focus, contact centre retention, navigation, service orientation, and tactful problem solving. In addition, the solution measures data entry speed and accuracy, multi-tasking preferences, achievement orientation and conscientiousness.",Not specified,"English International,","Entry-Level,",Approximate Completion Time in minutes = 39,"[{'title': 'Product Fact Sheet', 'url': 'https://service.shl.com/docs/Fact%20Sheet%20Contact%20Centre%20Agent%20-%20UK%20Short%20Form.pdf', 'language': 'English International'}]",Contact Centre Agent Solution - UK
